TS_toyota,7,6.5804088E+017,We love your choice of car #OrlandoBloom! Courtesy of @Zimbio.com https://t.co/H0qknHSGEC,dealership ad,10/24/2015 10:02 PM,en,0,1,0.7901,TRUE,FALSE,TRUE,FALSE
Toyota_Oakbrook,330,6.5794413E+017,We LOVE helping you save money! We have the perfect coupon for you! Check it out today! #CarCoupons https://t.co/7idZPwIQPz,dealership ad,10/24/2015  3:38 PM,en,0,0,0.9424,TRUE,TRUE,TRUE,FALSE
Toyota_Desert,27,6.5779893E+017,Get a #car you can trust with a price you'll #love with this 2015 #Toyota #Corolla. https://t.co/QO6Tfu1zh0,dealership ad,10/24/2015  6:01 AM,en,0,0,0.5106,TRUE,TRUE,FALSE,FALSE
DFWToyota,867,6.5769475E+017,Heading out for the night? Your friends will love all the room in your Toyota! https://t.co/uaJOnmE7cD,dealership ad,10/23/2015 11:07 PM,en,1,0,0.8221,TRUE,FALSE,TRUE,FALSE
YorktonToyota,75,6.5765217E+017,Let's see your Toyota Love - https://t.co/1ziwwHmjrf ... enter to win weekly prizes!  Just submit a photo... https://t.co/KYtcYegglB,dealership ad,10/23/2015  8:17 PM,en,0,0,0.906,TRUE,FALSE,TRUE,FALSE
ToyotaPartsCntr,394,6.5762644E+017,Does your Toyota love the beach? https://t.co/WAbIGP6qSh https://t.co/tzOTwOaxqa,dealership ad,10/23/2015  6:35 PM,en,0,0,0.6369,TRUE,FALSE,TRUE,FALSE
bobsmithtoyota,153,6.5762529E+017,We love hearing from YOU! Go to https://t.co/YwHd4W6mLf and tell us about your experience at Bob Smith Toyota! https://t.co/UQE00ZPIzk,dealership ad,10/23/2015  6:31 PM,en,0,0,0.6988,TRUE,TRUE,TRUE,FALSE
DOTHANTOYOTA,535,6.5762308E+017,"Congratulations to Brittany Logan on her brand new Toyota Highlander! You will absolutely love it!  Enjoy, have... https://t.co/gSL8Itq6Vj",dealership ad,10/23/2015  6:22 PM,en,1,0,0.9252,TRUE,FALSE,FALSE,FALSE
BarnhillAuto,5,6.5761345E+017,"@CaptDaveOnAir Ah, totally get that. Well, if your Toyota ever needs a little love, we're here to help you out! Would you keep us in mind?",dealership ad,10/23/2015  5:43 PM,en,0,0,0.8505,FALSE,FALSE,TRUE,FALSE
hudiburgtoyota,5003,6.575884E+017,"Oklahomans love long lasting vehicles and that's why they love Toyota's. Test drive the 2016 Toyota Camry, your... https://t.co/Tys1OGQXS5",dealership ad,10/23/2015  4:04 PM,en,0,0,0.8555,TRUE,FALSE,FALSE,TRUE
MikeCalvertToy,531,6.5756768E+017,We love providing you with specials! Check out the latest and greatest on awesome new #Toyota models here! https://t.co/ySNLg9b2Mt,dealership ad,10/23/2015  2:42 PM,en,0,0,0.9335,FALSE,TRUE,TRUE,FALSE
ask_for_liz,95,6.5756577E+017,Know someone looking for a New or Pre-Owned car? #Deerfieldbeach #Toyota has what you need and i would love to help.#askforliz #coralsprings,dealership ad,10/23/2015  2:34 PM,en,0,0,0.6369,FALSE,TRUE,TRUE,TRUE
Toyota_Oakbrook,330,6.5720987E+017,The year was 1973 when the #Toyota #Carina roamed the streets. Don't you love the retro color? #ThrowBackThursday https://t.co/RuOtlQzZY5,dealership ad,10/22/2015  3:00 PM,en,0,0,-0.5216,TRUE,TRUE,FALSE,FALSE
ask_for_liz,95,6.5686724E+017,Know someone looking to buy a New car? I would love to help #askforliz @ #Deerfieldbeach #Toyota . #boca #lasolas #weston #sawgrass #broward,dealership ad,10/21/2015  4:18 PM,en,1,0,0.7845,FALSE,TRUE,TRUE,TRUE
ask_for_liz,95,6.5666536E+017,Tomorrow is your day to drive off in your dream car. I'll be @ #Deerfieldbeach #Toyota all day tomorrow &amp,dealership ad, would love to help. #askforliz,10/21/2015  2:56 AM,en,0,0,FALSE,TRUE,TRUE,TRUE
billingstoyota,116,6.5660638E+017,You'll love driving home in this 2011 #Mazda CX-9 from Lithia #Toyota of #Billings today! - https://t.co/Fs173pyh8V,dealership ad,10/20/2015 11:02 PM,en,0,0,0.6696,TRUE,TRUE,TRUE,FALSE
ask_for_liz,95,6.5659283E+017,"The New car you deserve is here @ #Deerfield #Toyota waiting for you . Stop by tonight , I would love to help you out. #askforliz #florida",dealership ad,10/20/2015 10:08 PM,en,0,0,0.6908,FALSE,TRUE,TRUE,TRUE
ToyotaOfLV,2169,6.5659151E+017,"Release your inner driver with the #ToyotaCorolla! Trust us, you'll LOVE this car! https://t.co/rurhuMAHnG https://t.co/EgUfZja79T",dealership ad,10/20/2015 10:03 PM,en,0,0,0.8695,TRUE,TRUE,FALSE,TRUE
MJTOYOTA,208,6.565635E+017,lovebunny via DealerRater: Everyone was wonderful people and the environment is such a beautiful view. I love ... https://t.co/17heTrlTk2,dealership ad,10/20/2015  8:11 PM,en,0,0,0.9153,TRUE,TRUE,TRUE,FALSE
GOSchToyotaCA,2,6.565509E+017,"@TonyBusko I love that about it, it's so different! Are you a big Toyota fan as well?",dealership ad,10/20/2015  7:21 PM,en,0,0,0.8356,TRUE,FALSE,TRUE,FALSE
ClintBowyerAuto,1324,6.5654356E+017,Russell Beck just picked up his brand new 2016 @Toyota #Tundra We love our customers!! #Emporia https://t.co/xJqecDNbtr,dealership ad,10/20/2015  6:52 PM,en,0,3,0.6988,FALSE,TRUE,FALSE,TRUE
momentum_toyota,2,6.5652288E+017,"With a power moonroof, the #Toyota #4Runner #SR5 and Trail keeps you closer to the great outdoors you love. https://t.co/dFzwC799oZ",dealership ad,10/20/2015  5:30 PM,en,0,0,0.8519,TRUE,TRUE,FALSE,FALSE
ask_for_liz,95,6.5650636E+017,Do you or someone you know deserve a new car? I would love to help you get the car you deserve @ #Deerfieldbeach #Toyota . #askforliz #954,dealership ad,10/20/2015  4:24 PM,en,0,0,0.7845,FALSE,FALSE,TRUE,TRUE
LindopToyota,646,6.5641771E+017,You can't help but love the new #Toyota #Auris https://t.co/nGIul1BJX8,dealership ad,10/20/2015 10:32 AM,en,0,0,-0.7336,TRUE,TRUE,FALSE,FALSE
AutoZoneSA,180,6.5634914E+017,"Left vs. Right - Which bakkie do you love more, the Ford Ranger or the Toyota Hilux? https://t.co/0juV1Bof92",dealership ad,10/20/2015  6:00 AM,en,0,0,0.6369,FALSE,FALSE,FALSE,FALSE
Robbins_Toyota,92,6.5623526E+017,Robbins Toyota would love to thank Tina Ruth Daugherty for the purchase of her very nice Cobalt. Thank You very much https://t.co/bxLifFzvkk,dealership ad,10/19/2015 10:27 PM,en,0,0,0.911,TRUE,FALSE,TRUE,TRUE
Toyota_Desert,27,6.5622856E+017,We didn't know it would be so easy to fall in #love with the 2016 #Toyota #Camry. Come fall in love with one today! https://t.co/pOAuIuN9O9,dealership ad,10/19/2015 10:00 PM,en,0,0,0.8494,TRUE,TRUE,FALSE,FALSE
YubaCity_Toyota,517,6.561906E+017,Let’s get you back to doing what you love. Our service and parts departments get your Toyota the service it needs. https://t.co/fLnIsNrx6O,dealership ad,10/19/2015  7:30 PM,en,0,0,0.6369,TRUE,FALSE,TRUE,FALSE
FrankKrat,369,6.5876389E+017,I love it when Ethan rolls coal in his Toyota Avalon,driver,10/26/2015  9:55 PM,en,2,3,0.6369,FALSE,TRUE,FALSE,FALSE
mantustoboggan,175,6.5847749E+017,@itsBayleyWWE I love you for owning a Toyota,driver,10/26/2015  2:57 AM,en,0,0,0.6369,FALSE,FALSE,TRUE,FALSE
ToriKnight315,200,6.5770398E+017,"If you drive a Toyota and listen to gangsta rap, I probably love you already.",driver,10/23/2015 11:43 PM,en,3,8,0.6369,FALSE,TRUE,TRUE,TRUE
KarennBabyy,128,6.5744047E+017,To the guy with the 2013 Black Toyota Camry with the weed sticker on the back.. Can you please stop leaving me love notes on my car. Thanks!,driver,10/23/2015  6:16 AM,en,0,1,0.8172,FALSE,FALSE,FALSE,FALSE
MarkDuplass,232639,6.5734652E+017,"Fact: @jonlajoiecomedy drives a really dirty, bashed up Toyota Camry from the early 2000's. I love him so much for this.",driver,10/23/2015 12:03 AM,en,53,250,0.2516,FALSE,FALSE,FALSE,TRUE
ProperlySeared,869,6.5667048E+017,Caribbeans Love Toyota...... 😊 https://t.co/Si0z6HzDJp,driver,10/21/2015  3:16 AM,en,0,0,0.6369,FALSE,TRUE,TRUE,FALSE
E_V_Edwards,142,6.5638911E+017,"Great cycle in, except for the fag smoking, JeremyKyleesque scrote  in an ancient Toyota trying to play skittles with me. Got to love #Yate",driver,10/20/2015  8:38 AM,en,0,1,0.8225,FALSE,FALSE,TRUE,TRUE
banishamse,1403,6.5869749E+017,#Toyota #palestine  #struggle more than 60 years #to #recover #freedom #support#tell #truth #love #palestine #rights #yes#Palestine,isis,10/26/2015  5:31 PM,en,0,0,0,FALSE,TRUE,TRUE,FALSE
Danschaefer12,63,6.5843432E+017,I love how ISIS uses Toyota vehicles. Good advertising on Toyota's part,isis,10/26/2015 12:05 AM,en,0,0,0.7964,FALSE,FALSE,FALSE,TRUE
mustaphaDM,408,6.5878057E+017,I love Vibe (Pontiac) #vibe #pontiacVibe #generalmotors #pontiac #pontiaconly  #toyota #pontiac2010… https://t.co/yXluAsaLtC,other company ,10/26/2015 11:01 PM,en,0,0,0.6369,FALSE,TRUE,TRUE,FALSE
macorrea1969,29,6.5847581E+017,"@Toyota @Pontiac I love my 2005 Pontiac Vibe. Just reached 299,000 miles and my odometer stopped. Can you help? https://t.co/NKJAzpw51E",other company ,10/26/2015  2:50 AM,en,0,0,0.7506,FALSE,TRUE,TRUE,FALSE
markyfla,160,6.5894608E+017,an excellent video diary of a Toyota land cruiser restoration https://t.co/kEvkbrcP6c absolutely love these,prop,10/27/2015  9:59 AM,en,0,0,0.8479,FALSE,FALSE,FALSE,FALSE
TF_110b,8,6.592621E+017,@DannyFChen @ToyotaMotorCorp love Ichiro! Glad hes with Toyota!,racing,10/28/2015  6:55 AM,en,0,1,0.8309,FALSE,TRUE,FALSE,FALSE
wouter_weez,71,6.5912441E+017,@dirtgame @Codemasters Will you please put the Toyota Corolla WRC In the DIRT RALLY game. I love this car. https://t.co/bCBznmxt59,racing,10/27/2015  9:47 PM,en,0,0,0.5215,FALSE,FALSE,FALSE,FALSE
SheriffGbailey,781,6.5756977E+017,@JBLaudio @CBellRacing21 @KBMteam @ToyotaRacing i love JBL and hate that terrorism official car Toyota,racing,10/23/2015  2:50 PM,en,0,0,-0.6249,FALSE,FALSE,FALSE,TRUE
BWT_Toyota,201,6.5947972E+017,"@ShotByJinx__ Love your cover photo! We noticed you're a photographer -- did you take that picture, too?",yes,10/28/2015  9:19 PM,en,0,0,0.6696,TRUE,TRUE,TRUE,FALSE
JeanevaFalafel,206,6.5947543E+017,MY POOR BABY. SENDING LOVE TO MY TOYOTA. YOU DIDN'T DESERVE THIS AT ALL.,yes,10/28/2015  9:02 PM,en,0,1,0.2732,FALSE,TRUE,TRUE,FALSE
Francescaj67,65,6.5944331E+017,3 days til i collect my new love 😍♥️🚘 #Toyota #ToyotaAurisSport https://t.co/ZtksJVZpBR,yes,10/28/2015  6:55 PM,en,0,0,0.6369,FALSE,TRUE,FALSE,FALSE
EmiForLove,329273,6.5942195E+017,#Toyota global love is our theme &amp,yes, has gone viral now twice with more then 145 Million social outreach in our group  https://t.co/T5GKbt,10/28/2015  5:30 PM,en,5,2,FALSE,TRUE,TRUE,FALSE
Kate_CRAZY_Pole,740,6.594064E+017,#VogliamoMikaNeiTeatriItaliani Love Today Tomorrow Toyota,yes,10/28/2015  4:28 PM,en,1,0,0.6369,FALSE,FALSE,TRUE,FALSE
shortiekuehn,104,6.5938676E+017,@EmiForLove @Casio @Toyota @McDonalds CONGRATULATIONS EMI! You are an inspiration to all survivors &amp,yes, fighters of breast cancer! Love you,10/28/2015  3:10 PM,en,0,1,FALSE,TRUE,TRUE,FALSE
KtSmokesHydro,2783,6.5937927E+017,@allisteez I love them. Ryan has 2 1989 Toyota 4 runner he's fixing up he's obsessed turning one into a monster 4x4,yes,10/28/2015  2:40 PM,en,0,1,0.5423,FALSE,FALSE,TRUE,FALSE
maddisenadair,382,6.5936087E+017,"Just saw someone with an Instagram bio that said ""in love with my 2014 Toyota Camry"" ok what why ???",yes,10/28/2015  1:27 PM,en,0,2,0.787,FALSE,FALSE,FALSE,FALSE
Toyota_Desert,27,6.5934416E+017,"""Choose a #job you #love, and you will never have to work a day in your life."" --Proverb #life #quote",yes,10/28/2015 12:21 PM,en,0,0,0,TRUE,FALSE,TRUE,FALSE
kel_azwad,17,6.5934248E+017,i love #turbo_toyota &lt,yes,3 https://t.co/txc8GbHSZ6,10/28/2015 12:14 PM,en,0,0,FALSE,TRUE,TRUE,FALSE
Ar_car_na,248,6.5932915E+017,"Dear Mazda - imitation is the sincerest form of... what was it again? Love, Toyota. https://t.co/NHPQIzH35H",yes,10/28/2015 11:21 AM,en,18,30,0.8689,FALSE,TRUE,TRUE,FALSE
Ierai,319,6.5929971E+017,"@Toyota_UAE Glad you like the shot!I wasnt,but after  crossing Oman N to S and back to N with the FJ..you gotta love it!! @elputoJay",yes,10/28/2015  9:24 AM,en,0,1,0.8904,FALSE,TRUE,TRUE,FALSE
ZimMotorShow,317,6.5927845E+017,Wonder if this will be at the #ZMS2016 gotta love that #Toyota https://t.co/0D25qeuQCC,yes,10/28/2015  8:00 AM,en,0,0,0.6369,FALSE,FALSE,TRUE,FALSE
MotoringHistory,120,6.5926807E+017,@ToyotaMotorCorp @toyota_europe We love this vintage photograph and the quote! Thank you.,yes,10/28/2015  7:18 AM,en,0,1,0.7901,FALSE,TRUE,TRUE,FALSE
Vanessa4Change,4,6.5919753E+017,@CoveGuardians Revenue=action.  Tell Japanese brands you love @Toyota @Subaru to Take a Stand,yes,10/28/2015  2:38 AM,en,2,4,0.6369,FALSE,TRUE,TRUE,FALSE
teguhku,150,6.5917314E+017,If i couldn't be strong .. Would you still love me… ♫ Locked Away by R. City (at Toyota Auto2000 Puri Kembangan) — https://t.co/7q9GTv,yes,10/28/2015  1:01 AM,en,0,0,0.3607,FALSE,TRUE,TRUE,FALSE
dustyDeGroff,137,6.5915519E+017,@5280Adam @Toyota your gonna love it!,yes,10/27/2015 11:50 PM,en,0,1,0.6696,FALSE,TRUE,FALSE,FALSE
TBP_Tiger_GAC,492,6.5913243E+017,@AaronGoodwin Its a toyota... Ew.. 😓 Sorry Aaron... Still love ya!!,yes,10/27/2015 10:19 PM,en,0,2,0.6688,FALSE,TRUE,TRUE,FALSE
JDMAuctionWatch,75,6.5911274E+017,These Toyota Crown Taxi's are everywhere in Japan... would love to see someone build one into a drift car!,yes,10/27/2015  9:01 PM,en,0,0,0.6696,FALSE,FALSE,FALSE,FALSE
Kinsel_Toyota,787,6.590985E+017,"""The love of family and the admiration of friends is much more important than wealth and privilege.""  ~Charles Kuralt",yes,10/27/2015  8:05 PM,en,0,0,0.9465,TRUE,TRUE,TRUE,FALSE
FinishedbyFive,1230,6.5909752E+017,Just &lt 3 Gord @ #RedDeer #Toyota on Lantern. Love the phone call from you just now buddy! you da best &amp ,yes,, I'm calling you when I buy a T,10/27/2015  8:01 PM,en,0,FALSE,TRUE,TRUE,FALSE
Adrianna_luis,19,6.5908481E+017,LOVE MY RING AND NAILS &amp,yes, ABSOLUTELY LOVE ❤ MY CAR 🚗 #Toyota #Yaris… https://t.co/3e3FTxNfmR,10/27/2015  7:10 PM,en,1,0,FALSE,TRUE,TRUE,FALSE
SamShughart,209,6.590796E+017,@AutumnRoyer @Toyota Stop making fun of me! I love Back to The Future😂😩,yes,10/27/2015  6:49 PM,en,1,1,0.7644,FALSE,TRUE,TRUE,FALSE
SelfieRobot,942,6.5901758E+017,#gedi#fortuner#reyben#aviator#toyota#love#car#f4f#days#winter#come#tdh#lounge#frnds#selfies#cp#instamood#instadaily… https://t.co/ZSk0X8EA,yes,10/27/2015  2:43 PM,en,0,0,0,FALSE,TRUE,FALSE,FALSE
gmulholland1980,1,6.5896417E+017,"Also give us some more JDM icons, with more customisation options, I would love the s14, 180sx and the toyota Mark II. Inspire us please :)",yes,10/27/2015 11:11 AM,en,0,0,0.9217,FALSE,FALSE,TRUE,FALSE
AnmarBne,98,6.5896077E+017,It's a nice street 🛣 I love it #prius #toyota #amman #jordan @ Shafa Badran https://t.co/o5QbuEPjxg,yes,10/27/2015 10:57 AM,en,0,0,0.7906,FALSE,TRUE,FALSE,FALSE
chrystabelled,189,6.5892161E+017,Commando drives pregnant Michelle Bridges around in smashed up Toyota https://t.co/3ZaESQr6Fy @DailyMailCeleb,yes,10/27/2015  8:22 AM,en,0,0,0,FALSE,FALSE,TRUE,TRUE
RoyDT,8448,6.5887532E+017,@JessFoxxx @Toyota_Aus love it!,yes,10/27/2015  5:18 AM,en,0,0,0.6696,FALSE,TRUE,TRUE,FALSE
ZokRaceCarbs,12,6.58862E+017,Just love rebuilding these toyota blowers - not - the smell that comes out of these when you open the oil cavity... https://t.co/smD41cT36T,yes,10/27/2015  4:25 AM,en,0,0,0.6369,FALSE,FALSE,TRUE,FALSE
VScomedy,242,6.5883227E+017,@KyleBusch Congrads on getting M&amp,yes,M #Mars #Toyota advanced in #TheChase Would love to do #NASCAR #podcast with you https://t.co/lvSwcf047,10/27/2015  2:27 AM,en,0,0,FALSE,TRUE,FALSE,TRUE
iloveqatar,53452,6.5882657E+017,"A message from @Toyota #Japan - ""we are so grateful to Qatar's love or Land Cruisers. We've never seen something like this."" #MrQinTokyo",yes,10/27/2015  2:04 AM,en,1,3,0.788,FALSE,TRUE,TRUE,FALSE
EtheWHITAKER,91,6.5876972E+017,"@Woo_Husky I love it, I love Subaru, my next car. I need one for Toyota Land Cruiser",yes,10/26/2015 10:18 PM,en,0,2,0.8555,FALSE,TRUE,FALSE,FALSE
LindopToyota,646,6.5874503E+017,Fancy a cuppa pop in &amp,yes, see us we love tea &amp, coffee as much as we love our cars #Toyota #takeABreak #lindopToyota https://t.co/EWwxEe,10/26/2015  8:40 PM,en,1,TRUE,TRUE,TRUE,FALSE
lovinn_jakai,295,6.5871886E+017,@1BOSSLADYYY I swear yall love them Toyota,yes,10/26/2015  6:56 PM,en,0,1,0.6124,FALSE,FALSE,FALSE,FALSE
toyota_autoc,1,6.5871518E+017,I think I'm in love. https://t.co/COV9c9jrgc,yes,10/26/2015  6:41 PM,en,0,0,0.6369,TRUE,TRUE,TRUE,FALSE
jackson_garner,142,6.5863744E+017,The Toyota has a love bug graveyard on the front end,yes,10/26/2015  1:32 PM,en,0,7,0.4588,FALSE,FALSE,TRUE,FALSE
ugo_danjuma,674,6.5860684E+017,"Very true, you either love samsung or the iphone,  same way you either love toyota or honda. Not the both https://t.co/H5gIY94xvX",yes,10/26/2015 11:31 AM,en,0,0,0.9099,FALSE,FALSE,TRUE,FALSE
Limecello,4631,6.5846686E+017,"Uh Toyota? No. I mean, I love football. I REALLY fucking love football. But…if I were to ever get married, it wouldn't be on the damn fiel",yes,10/26/2015  2:15 AM,en,0,1,0.6705,FALSE,TRUE,TRUE,FALSE
nikhak,1266,6.5846178E+017,@jvlaha @ChicagoFire @wunitedfc @FireWUFC @Cf97Sirens @Section8Chicago I love this scarf. OG Toyota Park days.,yes,10/26/2015  1:54 AM,en,0,0,0.6369,FALSE,FALSE,TRUE,TRUE
SP_JohnSullivan,686,6.5841985E+017,@Toyota @kelliwardaz BTW I need a 1996 Avalon driver's side mirror. Competitors don't have drivers still talking about 1996. I love you.,yes,10/25/2015 11:08 PM,en,0,0,0.6369,FALSE,TRUE,FALSE,TRUE
rampantlyon,37,6.5840887E+017,I sure do love it here. I will miss coming out to this place. @ Toyota… https://t.co/ufRyGxyCB6,yes,10/25/2015 10:24 PM,en,0,0,0.7096,FALSE,FALSE,TRUE,FALSE
Toyota_Preius,311,6.5834801E+017,I have a love hate relationship with the patriots,yes,10/25/2015  6:22 PM,en,0,0,0.128,TRUE,TRUE,TRUE,FALSE
MajiiKunMJ,1500,6.5833691E+017,In love with you #stance #stancelovers #stancenation #corolla #ohsoretro #toyota #lowered… https://t.co/I3ELSIZArb,yes,10/25/2015  5:38 PM,en,0,0,0.6369,FALSE,TRUE,FALSE,FALSE
RantiScreamer,612,6.5826364E+017,"I love 5star ads. Airtel, Idea and Toyota learn something from it. Hire new and better ad. agency.",yes,10/25/2015 12:47 PM,en,0,0,0.7964,FALSE,FALSE,FALSE,FALSE
DJEddieOne,33396,6.5821447E+017,Full house last night at the @congaroom 🎉 for all my people that love to dance. @Toyota is hooking it… https://t.co/44RD0bApWZ,yes,10/25/2015  9:32 AM,en,0,1,0.6369,FALSE,TRUE,TRUE,FALSE
Simplyy_Kiondra,1700,6.5817053E+017,@Toyota_CAMRYx3 - I love my life.,yes,10/25/2015  6:37 AM,en,0,0,0.6369,FALSE,TRUE,FALSE,FALSE
Toyota_Kamree,762,6.581554E+017,I love FAM. They're sending out texts making sure everyone made it home safely,yes,10/25/2015  5:37 AM,en,1,0,0.8658,TRUE,TRUE,TRUE,FALSE
mariogoso,10104,6.5815037E+017,Integrated PR @integrated_pr: Actress @BlancaBlanco IPR founder @MoniqueMoss love @TheSimpsons and support @green4EMA  @Toyota @Lexus...,yes,10/25/2015  5:17 AM,en,0,0,0.7845,FALSE,TRUE,TRUE,FALSE
integrated_pr,88603,6.5814955E+017,Actress @BlancaBlanco IPR founder @MoniqueMoss love @TheSimpsons and support @green4EMA  @Toyota @Lexus #ToyotaMirai https://t.co/yy3P8YyW3K,yes,10/25/2015  5:14 AM,en,1,2,0.7845,FALSE,TRUE,FALSE,FALSE
Ladyjethro1,42,6.5810087E+017,@NHLFlyers @Toyota love the lavender,yes,10/25/2015  2:00 AM,en,0,0,0.6369,FALSE,TRUE,TRUE,FALSE
Toyota_CAMRYx3,869,6.5810073E+017,I need to talk to you 😓 love me @FlyGuyKelz,yes,10/25/2015  2:00 AM,en,0,0,0.6369,TRUE,TRUE,TRUE,FALSE
Obama_Ointment,3681,6.5804252E+017,"@FoxNews @vito4224 Strike until the cows come home for all I care #UAW #GovernmentMotors #Detroit #union scum, I love my #TX built #Toyota",yes,10/24/2015 10:08 PM,en,2,2,0.7845,FALSE,TRUE,TRUE,FALSE
avendanoerik_,147,6.5803031E+017,I LOVE THIS. https://t.co/0tFJV3yVSU,yes,10/24/2015  9:20 PM,en,0,0,0.7125,FALSE,TRUE,TRUE,FALSE
JonivaErnst,353,6.5796047E+017,getting senior pictures taken in the middle of the street like yes i would love to get run over by a 2003 toyota camry,yes,10/24/2015  4:42 PM,en,1,5,0.8555,FALSE,TRUE,FALSE,FALSE
cherastus,20,6.5790871E+017,"I really love airtel, ready to win the Toyota car,in Jesus name",yes,10/24/2015  1:17 PM,en,0,0,0.9013,FALSE,FALSE,TRUE,FALSE
TimCWing,91,6.5789498E+017,@LOCASHmusic love the new look guys. Not sure what Toyota is doing here.  #randomladypic https://t.co/LVAe5I1hYD,yes,10/24/2015 12:22 PM,en,0,0,0.7579,FALSE,TRUE,FALSE,FALSE
AnnaRoseBaldwin,1107,6.5783655E+017,Happy birthday to my sisterr👭. I hope you have the best day&amp,yes, night possible. Enjoy your presents!!💘 Love you toyota https://t.co/E,10/24/2015  8:30 AM,en,0,2,FALSE,TRUE,TRUE,FALSE
Toyota_CAMRYx3,869,6.5780935E+017,that's why I'm never falling in love ever again,yes,10/24/2015  6:42 AM,en,0,0,-0.4449,TRUE,TRUE,TRUE,FALSE
Ralstonsmusic,2730,6.5772968E+017,@Toyota Hello. Sharing this dream. https://t.co/CrikMjD7Dt https://t.co/Yzp27Ygyai Enjoy. One love. https://t.co/Mabxhjp76c,yes,10/24/2015  1:25 AM,en,0,2,0.9091,FALSE,TRUE,TRUE,FALSE
Toyota_CAMRYx3,869,6.5772893E+017,do all I can't just to show you you're special. certain it's your love that holds me together.,yes,10/24/2015  1:22 AM,en,0,1,0.8402,TRUE,TRUE,TRUE,FALSE
WaterRollsUphil,8943,6.5770583E+017,Vote for the #Toyota #MR2!  Love the adubs!  https://t.co/sKZnfwCHDv #SoapBox2015 https://t.co/Z7pqP5RX7D,yes,10/23/2015 11:51 PM,en,0,1,0.6988,FALSE,TRUE,FALSE,FALSE
jeromiemtz,48,6.5768984E+017,@LanceTheDriver1 @Toyota I LOVE mine. https://t.co/mm6mHZSD8h,yes,10/23/2015 10:47 PM,en,0,3,0.7125,FALSE,TRUE,TRUE,TRUE
MD1Henderson22,135,6.5762205E+017,"@triadrt @Kenny_Wallace I was just curious, I work for Toyota Technical Center so I race a crate late model Would love to race a @Toyota",yes,10/23/2015  6:18 PM,en,0,0,0.7579,FALSE,FALSE,FALSE,TRUE
Toyota_Oakbrook,330,6.5760707E+017,@ImpactBodyWorks Love this!,yes,10/23/2015  5:18 PM,en,0,0,0.6696,TRUE,TRUE,TRUE,FALSE
206inc,1463,6.5759545E+017,@HarroldWith2Rs @Toyota love this!,yes,10/23/2015  4:32 PM,en,0,1,0.6696,FALSE,TRUE,TRUE,FALSE
Toyota,533585,6.5759376E+017,@SPODemonic We love nostalgic rode trips! #LetsGoPlaces,yes,10/23/2015  4:25 PM,en,0,0,0.6696,TRUE,TRUE,TRUE,FALSE
ToyotaWC,593,6.5752627E+017,"Photo: #fbf 1967 #Toyota #2000gt #flashbackfriday I don’t know about you, but I love it! https://t.co/mNLIhUX3Sb",yes,10/23/2015 11:57 AM,en,0,0,0.7959,TRUE,TRUE,FALSE,FALSE
Toyota_Camaury,171,6.575041E+017,"Please, for the love of god, no one let Germany know about the American expression ""third times the charm"".",yes,10/23/2015 10:29 AM,en,1,1,0.7506,TRUE,TRUE,TRUE,FALSE
10kArLcRockets,838,6.5743506E+017,Love the idea of putting the whole squad on the facade of Toyota!  https://t.co/iOZsiidoX8,yes,10/23/2015  5:55 AM,en,0,0,0.6696,FALSE,TRUE,FALSE,FALSE
Toyota_Preius,311,6.5737498E+017,"Can somebody anybody, get me some futures!!!!!!!!!! I'll love you forever 😁",yes,10/23/2015  1:56 AM,en,0,0,0.7482,TRUE,TRUE,TRUE,FALSE
idk_aylee,550,6.5736692E+017,i love michael j. fox fight me https://t.co/yQMl1Pkiy5,yes,10/23/2015  1:24 AM,en,0,0,0.3818,FALSE,TRUE,TRUE,FALSE
GOSchToyotaCA,2,6.5735074E+017,"@LaraWyss They are pretty amazing, you're going to love it! Are you driving a Toyota right now too?",yes,10/23/2015 12:20 AM,en,0,0,0.9098,TRUE,FALSE,TRUE,FALSE
snoflke,74,6.5731682E+017,🚘 little blue car ❄️SNOFLKE❄️ #mycar #snoflke #matrix #toyota #love #blue #sky #cornfeild #followme https://t.co/IXiFLZ1Uej,yes,10/22/2015 10:05 PM,en,0,0,0,FALSE,FALSE,FALSE,FALSE
MF3419,1027,6.572745E+017,@zbindendesign heres some truck love for your other followers.. #TUNDRA #TRD #400hp #ToyotaNation #5.7L @Toyota https://t.co/5MyVI7zbBx,yes,10/22/2015  7:17 PM,en,0,2,0.6369,FALSE,FALSE,FALSE,FALSE
Toyota_CAMRYx3,869,6.5726049E+017,sex amazing makes me wanna do it again. baby you're my weekend love,yes,10/22/2015  6:21 PM,en,0,0,0.8402,TRUE,TRUE,TRUE,FALSE
Rodge_FS,176,6.5725862E+017,I love you guys! https://t.co/qtvHdRNGIw,yes,10/22/2015  6:14 PM,en,0,0,0.6696,FALSE,TRUE,TRUE,FALSE
AnIceCreamCone,814,6.572485E+017,Love to find pics of me! (not my pic) #Cruiser ❤👌 #GoodPeople #IceCream #Mine #LoveIt #NelkiNa #INeededThis #Stressed #Toyota #GoodMusi,yes,10/22/2015  5:33 PM,en,0,0,0.6696,FALSE,TRUE,TRUE,FALSE
DSplus,234,6.572438E+017,They like us! (Maybe they even love us.) We’re a Certified Provider. https://t.co/15WffwkCLw https://t.co/7ZW3Lgqrao,yes,10/22/2015  5:15 PM,en,0,0,0.7901,FALSE,TRUE,FALSE,FALSE
gregisalunatic,47,6.5720499E+017,"Would love to know what this cost Toyota, haha. Might also surprise people to know I'm 100% supportive https://t.co/Y2mVNkAFvV",yes,10/22/2015  2:40 PM,en,0,0,0.8885,FALSE,TRUE,TRUE,FALSE
DebsJRiccio,310,6.5719914E+017,Love this: Michael J. Fox &amp,yes, Christopher Lloyd Go ‘Back To The Future’ In Full Toyota Commercial https://t.co/cvqzajPFVw via @Hollyw,10/22/2015  2:17 PM,en,0,0,FALSE,TRUE,TRUE,FALSE
planeshooter15,145,6.5716645E+017,@AdmarkUK @PrestigeDiesels @Toyota @jeffylew Love it!,yes,10/22/2015 12:07 PM,en,0,2,0.6696,FALSE,TRUE,FALSE,FALSE
evoMatthew,930,6.5711996E+017,"As much as I know it would be disappointing, I'd love to try one of these: https://t.co/FjADhWIhUu https://t.co/ai9rRmPmNe",yes,10/22/2015  9:03 AM,en,0,0,0.25,FALSE,TRUE,FALSE,FALSE
riani_toyota,17,6.5708687E+017,I love u abi @rmnk_fz https://t.co/f38EAtjQj9,yes,10/22/2015  6:51 AM,en,0,0,0.6369,TRUE,TRUE,TRUE,FALSE
Josephv_27,405,6.5705098E+017,I think I'm in love! 😍 https://t.co/Xm45jxZmye,yes,10/22/2015  4:28 AM,en,2,0,0.6696,FALSE,TRUE,TRUE,FALSE
ann_m_stone,539,6.5703967E+017,love it! https://t.co/E3aipWiXYc,yes,10/22/2015  3:43 AM,en,0,0,0.6696,FALSE,TRUE,TRUE,FALSE
limon_con_sal17,737,6.570305E+017,I LOVE THIS SO MUCH ! https://t.co/a8SByhafIC,yes,10/22/2015  3:07 AM,en,1,0,0.7371,FALSE,TRUE,TRUE,FALSE
TimiKomo,899,6.5701993E+017,Love it &gt,yes,&gt, Ad of the Day: Here Is Toyota's Full 5-Minute Spot With Marty McFly and Doc Brown https://t.co/ThfQ2XkurW,10/22/2015  2:25 AM,en,0,FALSE,TRUE,TRUE,FALSE
NoNonsenseMofo,1509,6.5701776E+017,I love it!  https://t.co/DtfZX8AtwC,yes,10/22/2015  2:16 AM,en,0,1,0.6696,FALSE,TRUE,TRUE,FALSE
brettconner_,171,6.5701683E+017,#GreatScott @Srdiv4 spread the love https://t.co/r8XtmvhVJK,yes,10/22/2015  2:13 AM,en,0,0,0.6369,FALSE,TRUE,TRUE,FALSE
